{
  "change_id": "CR-2026-0452",
  "findings": [
    {
      "dimension": "rollback_feasibility",
      "severity": "blocker",
      "finding": "Rollback plan step 2 relies on restoring pre-migration database backup, but change scope includes schema_migration=true. Restoring a backup after a schema migration would lose all data written after migration.",
      "evidence": {
        "artifact": "rollback_plan",
        "location": "step 2",
        "field": "schema_migration"
      },
      "remediation": "Design forward-compatible rollback: nullable column addition with migration-down script, or blue-green database strategy."
    }
  ],
  "feasibility_verdict": "infeasible",
  "estimated_duration_min": 30
}
